{"$id":"https://agent-ops.ru/schemas/run_request.schema.json","$schema":"https://json-schema.org/draft/2020-12/schema","additionalProperties":false,"properties":{"action_catalog":{"additionalProperties":false,"properties":{"id":{"const":"agent-ops.action_catalog.read_only"},"sha256":{"pattern":"^[a-f0-9]{64}$","type":"string"},"version":{"const":"0.1.0"}},"required":["id","version","sha256"],"type":"object"},"authority_ref":{"pattern":"^[a-z0-9][a-z0-9._/-]{0,255}$","type":"string"},"baseline_provider":{"additionalProperties":false,"properties":{"id":{"const":"baseline/disk"},"sha256":{"pattern":"^[a-f0-9]{64}$","type":"string"},"version":{"const":"0.1.0"}},"required":["id","version","sha256"],"type":"object"},"contract":{"additionalProperties":false,"properties":{"id":{"const":"agent-ops.run_request"},"version":{"const":"0.1.0"}},"required":["id","version"],"type":"object"},"environment_ref":{"$ref":"foundation_object_ref.schema.json"},"external_corpus_packs":{"items":{"additionalProperties":false,"properties":{"id":{"pattern":"^[a-z0-9][a-z0-9._/-]{0,127}$","type":"string"},"sha256":{"pattern":"^[a-f0-9]{64}$","type":"string"},"version":{"pattern":"^[0-9]+\\.[0-9]+\\.[0-9]+$","type":"string"}},"required":["id","version","sha256"],"type":"object"},"maxItems":32,"type":"array"},"harness_snapshot":{"additionalProperties":false,"properties":{"id":{"const":"agent-ops.harness.snapshot"},"sha256":{"pattern":"^[a-f0-9]{64}$","type":"string"},"version":{"const":"0.1.0"}},"required":["id","version","sha256"],"type":"object"},"limits":{"additionalProperties":false,"properties":{"actions":{"maximum":1024,"minimum":1,"type":"integer"},"references":{"maximum":4096,"minimum":1,"type":"integer"},"request_bytes":{"maximum":1048576,"minimum":1,"type":"integer"}},"type":"object"},"mode":{"enum":["manual","governed"]},"profile_ref":{"pattern":"^agent-ops\\.[a-z0-9._-]+@0\\.1\\.0$","type":"string"},"project_ref":{"$ref":"foundation_object_ref.schema.json"},"service_ref":{"$ref":"foundation_object_ref.schema.json"},"target":{"additionalProperties":false,"properties":{"cluster_ref":{"pattern":"^[a-z0-9][a-z0-9._/-]{0,255}$","type":"string"},"declared_ref":{"maxLength":255,"minLength":1,"not":{"pattern":"\\.\\."},"pattern":"^[A-Za-z0-9][A-Za-z0-9._-]{0,254}$","type":"string"},"host_ref":{"pattern":"^[a-z0-9][a-z0-9._@:-]{0,255}$","type":"string"},"scope":{"enum":["local","host","cluster","declared"]}},"required":["scope"],"type":"object"}},"required":["contract","mode","project_ref","environment_ref","target","profile_ref","action_catalog","harness_snapshot","baseline_provider","external_corpus_packs"],"title":"Gitinsky Typed Run Request","type":"object"}
